<?xml version="1.0" encoding="UTF-8"?>
<?xml-model href="../../schemas/recommendation.xsd" type="application/xml" schematypens="http://purl.oclc.org/dsdl/schematron"?> 
<recommendation xmlns:xsi="http://www.w3.org/2001/XMLSchema-instance" xsi:noNamespaceSchemaLocation="../../schemas/recommendation.xsd">
   <header>
      <lastUpdateCommitID>d4ad73e931b56f907716917299724fce4466f996</lastUpdateCommitID>
      <filter>
         <centreID>CLARIN.SI</centreID>
      </filter>
      <respStmt>
         <name>Jakob Lenardič</name>
         <resp><!--optionally specify the range of responsibility; useful if multiple respStmt are used--></resp>
         <link>https://github.com/jakoble</link>
         <reviewDate>2026-06-19</reviewDate>
      </respStmt>
      <centre id="CLARIN.SI" deposition="1">
         <centreName>CLARIN.SI Language Technology Centre, Slovenia</centreName>
         <registryLink registry="CLARIN" uri="https://centres.clarin.eu/centre/30"/>
         <nodeInfo>
            <ri status="B-centre">CLARIN</ri>
         </nodeInfo>
      </centre>
   </header>
   <info>
      <p>This page lists the file formats which are recommended for depositing in CLARIN.SI. For additional information, see 
         <a href="https://www.clarin.si/repository/xmlui/page/data">https://www.clarin.si/repository/xmlui/page/data</a>.</p>
      <p>For details on the preservation policy of CLARIN.SI, see 
         <a href="https://www.clarin.si/repository/xmlui/page/about#preservation-policy">https://www.clarin.si/repository/xmlui/page/about#preservation-policy</a>.</p>
   </info>
   <formats>
      <format id="fEXB">
         <domain>Audiovisual Annotation</domain>
         <level>recommended</level>
      </format>
      <format id="fEXS">
         <domain>Audiovisual Annotation</domain>
         <level>recommended</level>
      </format>
      <format id="fFLN">
         <domain>Audiovisual Annotation</domain>
         <level>recommended</level>
      </format>
      <format id="fTEISpoken">
         <domain>Audiovisual Annotation</domain>
         <level>recommended</level>
      </format>
      <format id="fTRS">
         <domain>Audiovisual Annotation</domain>
         <level>recommended</level>
      </format>
      <format id="fAIFF">
         <domain>Audiovisual Source Language Data</domain>
         <level>recommended</level>
      </format>
      <format id="fAVI">
         <domain>Audiovisual Source Language Data</domain>
         <level>recommended</level>
      </format>
      <format id="fFLAC">
         <domain>Audiovisual Source Language Data</domain>
         <level>recommended</level>
      </format>
      <format id="fM2J">
         <domain>Audiovisual Source Language Data</domain>
         <level>recommended</level>
      </format>
      <format id="fM4A">
         <domain>Audiovisual Source Language Data</domain>
         <level>recommended</level>
      </format>
      <format id="fMP3">
         <domain>Audiovisual Source Language Data</domain>
         <level>recommended</level>
      </format>
      <format id="fMP4">
         <domain>Audiovisual Source Language Data</domain>
         <level>recommended</level>
      </format>
      <format id="fMPEG1">
         <domain>Audiovisual Source Language Data</domain>
         <level>recommended</level>
      </format>
      <format id="fMPEG2">
         <domain>Audiovisual Source Language Data</domain>
         <level>recommended</level>
      </format>
      <format id="fRAW">
         <domain>Audiovisual Source Language Data</domain>
         <level>recommended</level>
      </format>
      <format id="fWAVE">
         <domain>Audiovisual Source Language Data</domain>
         <level>recommended</level>
      </format>
      <format id="fCMDI">
         <domain>Catalogue Metadata</domain>
         <level>recommended</level>
      </format>
      <format id="fHTML">
         <domain>Documentation</domain>
         <level>recommended</level>
      </format>
      <format id="fPDF">
         <domain>Documentation</domain>
         <level>recommended</level>
      </format>
      <format id="fTEI">
         <domain>Documentation</domain>
         <level>recommended</level>
      </format>
      <format id="fXML">
         <domain>Documentation</domain>
         <level>recommended</level>
      </format>
      <format id="fKML">
         <domain>Geodata</domain>
         <level>recommended</level>
      </format>
      <format id="fGIF">
         <domain>Image Source Language Data</domain>
         <level>recommended</level>
      </format>
      <format id="fJPEG">
         <domain>Image Source Language Data</domain>
         <level>recommended</level>
      </format>
      <format id="fPDF">
         <domain>Image Source Language Data</domain>
         <level>recommended</level>
      </format>
      <format id="fPNG">
         <domain>Image Source Language Data</domain>
         <level>recommended</level>
      </format>
      <format id="fSVG">
         <domain>Image Source Language Data</domain>
         <level>recommended</level>
      </format>
      <format id="fTIFF">
         <domain>Image Source Language Data</domain>
         <level>recommended</level>
      </format>
      <format id="fCSV">
         <domain>Lexical Resource</domain>
         <level>recommended</level>
      </format>
      <format id="fLMF">
         <domain>Lexical Resource</domain>
         <level>recommended</level>
      </format>
      <format id="fTSV">
         <domain>Lexical Resource</domain>
         <level>recommended</level>
      </format>
      <format id="fR">
         <domain>Statistical Data</domain>
         <level>recommended</level>
      </format>
      <format id="fCoNLL-U">
         <domain>Text Annotation</domain>
         <level>recommended</level>
      </format>
      <format id="fPDF">
         <domain>Text Annotation</domain>
         <level>discouraged</level>
      </format>
      <format id="fRDFXML">
         <domain>Text Annotation</domain>
         <level>recommended</level>
      </format>
      <format id="fTEI">
         <domain>Text Annotation</domain>
         <level>recommended</level>
      </format>
      <format id="fTiger">
         <domain>Text Annotation</domain>
         <level>recommended</level>
      </format>
      <format id="fXML">
         <domain>Text Annotation</domain>
         <level>recommended</level>
      </format>
      <format id="fePub">
         <domain>Textual Source Language Data</domain>
         <level>recommended</level>
      </format>
      <format id="fEAF">
         <domain>Textual Source Language Data</domain>
         <level>recommended</level>
      </format>
      <format id="fFoLiA">
         <domain>Textual Source Language Data</domain>
         <level>recommended</level>
      </format>
      <format id="fPartitur">
         <domain>Textual Source Language Data</domain>
         <level>recommended</level>
      </format>
      <format id="fPDF">
         <domain>Textual Source Language Data</domain>
         <level>discouraged</level>
      </format>
      <format id="fPraat">
         <domain>Textual Source Language Data</domain>
         <level>recommended</level>
      </format>
      <format id="fTCF">
         <domain>Textual Source Language Data</domain>
         <level>recommended</level>
      </format>
      <format id="fTextPlain">
         <domain>Textual Source Language Data</domain>
         <level>recommended</level>
      </format>
      <format id="fCSS">
         <domain>Tool Support</domain>
         <level>recommended</level>
      </format>
      <format id="fDTD">
         <domain>Tool Support</domain>
         <level>recommended</level>
      </format>
      <format id="fGZIP">
         <domain>Packaging</domain>
         <level>recommended</level>
      </format>
      <format id="fJS">
         <domain>Tool Support</domain>
         <level>recommended</level>
      </format>
      <format id="fTAR">
         <domain>Packaging</domain>
         <level>recommended</level>
      </format>
      <format id="fXSD">
         <domain>Tool Support</domain>
         <level>recommended</level>
      </format>
      <format id="fXSLT">
         <domain>Tool Support</domain>
         <level>recommended</level>
      </format>
      <format id="fZIP">
         <domain>Packaging</domain>
         <level>recommended</level>
      </format>
   </formats>
</recommendation>
