<?xml version="1.0" encoding="UTF-8"?>
<?xml-model href="../../schemas/recommendation.xsd" type="application/xml" schematypens="http://purl.oclc.org/dsdl/schematron"?> 
<recommendation xmlns:xsi="http://www.w3.org/2001/XMLSchema-instance" xsi:noNamespaceSchemaLocation="../../schemas/recommendation.xsd">
    <header>
        <lastUpdateCommitID>bec52cd36a2996677ce07153a19ce774097f9130</lastUpdateCommitID>
        <filter>
            <centreID>CLARIN-IS</centreID>
        </filter>
        <respStmt>
            <name>Starkaður Barkarson</name>
            <link>https://github.com/starkadur</link>
            <reviewDate>2025-03-21</reviewDate>
        </respStmt>
        <centre id="CLARIN-IS" deposition="1">
        <centreName>CLARIN-IS (Árni Magnússon Institute for Icelandic Studies)</centreName>
        <registryLink registry="CLARIN" uri="https://centres.clarin.eu/centre/64"/>
        <nodeInfo>
          <ri status="B-centre">CLARIN</ri>
        </nodeInfo>
      </centre>
    </header>
    <info><!--use p, ul, ol elements here--></info>
    <formats><!--
            This template will assist in adjusting/creating a recommendations document if you don't
            have access to a schema-aware XML editor. Copy the XML fragment, 
            *  adjust the format ID (see https://clarin.ids-mannheim.de/standards/views/list-formats.xq ),
            *  adjust the domain (https://clarin.ids-mannheim.de/standards/views/list-domains.xq ),
            *  adjust the recommendation level ({ recommended, acceptable, discouraged }),
            *  repeat as necessary;
            *  submit the result as a PR against https://github.com/clarin-eric/standards/tree/formats .

       -->
        
        <format id="fMP3">
            <domain>Audiovisual Source Language Data</domain>
            <level>acceptable</level>
        </format>
        <format id="fAVI">
            <domain>Audiovisual Source Language Data</domain>
            <level>acceptable</level>
        </format>
        <format id="fMP4">
            <domain>Audiovisual Source Language Data</domain>
            <level>recommended</level>
        </format>        
        <format id="fOGG">
            <domain>Audiovisual Source Language Data</domain>
            <level>acceptable</level>
        </format>
        <format id="fMPEG">
            <domain>Audiovisual Source Language Data</domain>
            <level>recommended</level>
        </format>
        <format id="fEAF">
            <domain>Audiovisual Annotation</domain>
            <level>recommended</level>
        </format>

        <format id="fPDF">
            <domain>Documentation</domain>
            <level>recommended</level>
        </format>
        <format id="fTextPlain">
            <domain>Documentation</domain>
            <level>discouraged</level>
        </format>
        <format id="fTEI">
            <domain>Documentation</domain>
            <level>recommended</level>
        </format>
        <format id="fXML">
            <domain>Documentation</domain>
            <level>recommended</level>
        </format>

        <format id="fGIF">
            <domain>Image Source Language Data</domain>
            <level>recommended</level>
        </format>
        <format id="fJPEG">
            <domain>Image Source Language Data</domain>
            <level>recommended</level>
        </format>
        <format id="fPNG">
            <domain>Image Source Language Data</domain>
            <level>recommended</level>
        </format>
        <format id="fSVG">
            <domain>Image Source Language Data</domain>
            <level>recommended</level>
        </format>
        <format id="fTIFF">
            <domain>Image Source Language Data</domain>
            <level>recommended</level>
        </format>
        <format id="fXML">
            <domain>Lexical Resource</domain>
            <level>acceptable</level>
        </format>
        <format id="fLMF">
            <domain>Lexical Resource</domain>
            <level>recommended</level>
        </format>
        <format id="fCSV">
            <domain>Lexical Resource</domain>
            <level>recommended</level>
        </format>
        <format id="fTSV">
            <domain>Lexical Resource</domain>
            <level>recommended</level>
        </format>

        <format id="fR">
            <domain>Statistical Data</domain>
            <level>recommended</level>
        </format>
        <format id="fSPSS">
            <domain>Statistical Data</domain>
            <level>acceptable</level>
        </format>
      
        
        <format id="fTextPlain">
            <domain>Textual Source Language Data</domain>
            <level>recommended</level>
        </format>
        
        <format id="fCoNLL-U">
            <domain>Text Annotation</domain>
            <level>recommended</level>
        </format>
        <format id="fTEI">
            <domain>Text Annotation</domain>
            <level>recommended</level>
        </format>
        <format id="fXML">
            <domain>Text Annotation</domain>
            <level>acceptable</level>
        </format>
        <format id="fTEIHeader">
            <domain>Metadata</domain>
            <level>recommended</level>
        </format>
        <format id="fCMDI">
            <domain>Metadata</domain>
            <level>recommended</level>
        </format>
        <format id="fZIP">
            <domain>Packaging</domain>
            <level>recommended</level>
        </format>
        <format id="fTAR">
            <domain>Packaging</domain>
            <level>recommended</level>
        </format>
    </formats>
</recommendation>
