<?xml version="1.0" encoding="UTF-8"?>
<?xml-model href="../../schemas/recommendation.xsd" type="application/xml" schematypens="http://purl.oclc.org/dsdl/schematron"?> 
<recommendation xmlns:xsi="http://www.w3.org/2001/XMLSchema-instance" xsi:noNamespaceSchemaLocation="../../schemas/recommendation.xsd">
    <header>
        <lastUpdateCommitID>cf472288d749456c233974b5d2dde39f31f8600f</lastUpdateCommitID>
        <filter>
            <centreID>TROLLing</centreID>
        </filter>
        <respStmt>
            <name>Philipp Conzett</name>
            <resp><!--optionally specify the range of responsibility; useful if multiple respStmt are used--></resp>
            <link>https://github.com/philippconzett</link>
            <reviewDate>2025-11-01</reviewDate>
        </respStmt>
        <centre id="TROLLing" deposition="1">
            <centreName>The Tromsø Repository of Language and Linguistics</centreName>
            <registryLink registry="CLARIN" uri="https://centres.clarin.eu/centre/48"/>
            <nodeInfo>
                <ri status="C-centre">CLARIN</ri>
            </nodeInfo>
        </centre>
    </header>
    <info>
        <p>The Tromsø Repository of Language and Linguistics (
            <a href="https://info.trolling.uit.no/">TROLLing</a>) is a repository of data, code, and related materials used in 
            linguistic research. This page lists the file formats which are recommended for depositing in TROLLing. For more 
            information see our <a href="https://site.uit.no/dataverseno/deposit/prepare/#preferred-file-formats">Preferred file formats section</a>.</p>
    </info>
    <formats>
        <format id="fTextPlain">
            <domain>Text Annotation</domain>
            <level>recommended</level>
        </format>
        <format id="fCSV">
            <domain>Text Annotation</domain>
            <level>recommended</level>
        </format>
        <format id="fTSV">
            <domain>Text Annotation</domain>
            <level>recommended</level>
        </format>
        <format id="fXLSX">
            <domain>Text Annotation</domain>
            <level>recommended</level>
        </format>
        <format id="fPDFA">
            <domain>Contextual Data</domain>
            <level>recommended</level>
        </format>
        <format id="fDOCX">
            <domain>Contextual Data</domain>
            <level>recommended</level>
        </format>
        <format id="fTextPlain">
            <domain>Contextual Data</domain>
            <level>recommended</level>
        </format>
        <format id="fMarkdown">
            <domain>Contextual Data</domain>
            <level>recommended</level>
        </format>
        <format id="fTextPlain">
            <domain>Documentation</domain>
            <level>recommended</level>
        </format>
        <format id="fMarkdown">
            <domain>Documentation</domain>
            <level>recommended</level>
        </format>
        <format id="fPDFA">
            <domain>Documentation</domain>
            <level>recommended</level>
        </format>
        <format id="fTextPlain">
            <domain>Language Description</domain>
            <level>recommended</level>
        </format>
        <format id="fMarkdown">
            <domain>Language Description</domain>
            <level>recommended</level>
        </format>
        <format id="fXML">
            <domain>Language Description</domain>
            <level>recommended</level>
        </format>
        <format id="fPDFA">
            <domain>Language Description</domain>
            <level>recommended</level>
        </format>
        <format id="fJSON">
            <domain>Metadata</domain>
            <level>recommended</level>
        </format>
        <format id="fWAVE">
            <domain>Audiovisual Source Language Data</domain>
            <level>recommended</level>
        </format>
        <format id="fAIFF">
            <domain>Audiovisual Source Language Data</domain>
            <level>recommended</level>
        </format>
        <format id="fFLAC">
            <domain>Audiovisual Source Language Data</domain>
            <level>recommended</level>
        </format>
        <format id="fMP3">
            <domain>Audiovisual Source Language Data</domain>
            <level>recommended</level>
        </format>
        <format id="fOGG">
            <domain>Audiovisual Source Language Data</domain>
            <level>recommended</level>
        </format>
        <format id="fMPEG-4-AVC">
            <domain>Audiovisual Source Language Data</domain>
            <level>recommended</level>
        </format>
        <format id="fAVI">
            <domain>Audiovisual Source Language Data</domain>
            <level>recommended</level>
        </format>
        <format id="fMOV">
            <domain>Audiovisual Source Language Data</domain>
            <level>recommended</level>
        </format>
        <format id="fTIFF">
            <domain>Image Source Language Data</domain>
            <level>recommended</level>
        </format>
        <format id="fPNG">
            <domain>Image Source Language Data</domain>
            <level>recommended</level>
        </format>
        <format id="fJPEG">
            <domain>Image Source Language Data</domain>
            <level>recommended</level>
        </format>
        <format id="fSVG">
            <domain>Image Source Language Data</domain>
            <level>recommended</level>
        </format>
        <format id="fPICT">
            <domain>Image Source Language Data</domain>
            <level>recommended</level>
        </format>
        <format id="fGIF">
            <domain>Image Source Language Data</domain>
            <level>recommended</level>
        </format>
        <format id="fBMP">
            <domain>Image Source Language Data</domain>
            <level>recommended</level>
        </format>
        <format id="fTextPlain">
            <domain>Textual Source Language Data</domain>
            <level>recommended</level>
        </format>
        <format id="fMarkdown">
            <domain>Textual Source Language Data</domain>
            <level>recommended</level>
        </format>
        <format id="fXML">
            <domain>Textual Source Language Data</domain>
            <level>recommended</level>
        </format>
        <format id="fTEI">
            <domain>Textual Source Language Data</domain>
            <level>recommended</level>
        </format>
        <format id="fCSV">
            <domain>Textual Source Language Data</domain>
            <level>recommended</level>
        </format>
        <format id="fTSV">
            <domain>Textual Source Language Data</domain>
            <level>recommended</level>
        </format>
        <format id="fShapefile">
            <domain>Geodata</domain>
            <level>recommended</level>
        </format>
        <format id="fZIP">
            <domain>Packaging</domain>
            <level>recommended</level>
        </format>
        <format id="fSTATA.data-and-setup">
            <domain>Statistical Data</domain>
            <level>recommended</level>
        </format>
        <format id="fSPSS.data-and-setup">
            <domain>Statistical Data</domain>
            <level>recommended</level>
        </format>
        <format id="fR">
            <domain>Statistical Data</domain>
            <level>recommended</level>
        </format>
        <format id="fSPSS.por">
            <domain>Statistical Data</domain>
            <level>recommended</level>
        </format>
        <format id="fSPSS.sav">
            <domain>Statistical Data</domain>
            <level>recommended</level>
        </format>
        <format id="fSTATA.dta">
            <domain>Statistical Data</domain>
            <level>recommended</level>
        </format>
        <format id="fSAS.sd2">
            <domain>Statistical Data</domain>
            <level>recommended</level>
        </format>
    </formats>
</recommendation>
