<recommendation xmlns:xsi="http://www.w3.org/2001/XMLSchema-instance" xsi:noNamespaceSchemaLocation="../../schemas/recommendation.xsd">
    <header>
        <lastUpdateCommitID>066c009f5e1d16bcf71e9c9781dd351188b86edd</lastUpdateCommitID>
        <filter>
         <centre>ZIM</centre>
      </filter>
    </header>
    <formats>
        <format id="fTEISpoken">
            <domain>Audiovisual Annotation</domain>
            <level>recommended</level>
        </format>
        <format id="fM4A">
            <domain>Audiovisual Source Language Data</domain>
            <level>recommended</level>
        </format>
        <format id="fMOV">
            <domain>Audiovisual Source Language Data</domain>
            <level>recommended</level>
        </format>
        <format id="fMP3">
            <domain>Audiovisual Source Language Data</domain>
            <level>recommended</level>
        </format>
        <format id="fMP4">
            <domain>Audiovisual Source Language Data</domain>
            <level>recommended</level>
        </format>
        <format id="fWave">
            <domain>Audiovisual Source Language Data</domain>
            <level>recommended</level>
        </format>
        <format id="fCMDI">
            <domain>Catalogue Metadata</domain>
            <level>recommended</level>
        </format>
        <format id="fDOCX">
            <domain>Documentation</domain>
            <level>recommended</level>
        </format>
        <format id="fHTML">
            <domain>Documentation</domain>
            <level>recommended</level>
        </format>
        <format id="fLaTeX">
            <domain>Documentation</domain>
            <level>recommended</level>
        </format>
        <format id="fODT">
            <domain>Documentation</domain>
            <level>recommended</level>
        </format>
        <format id="fTEI">
            <domain>Documentation</domain>
            <level>recommended</level>
        </format>
        <format id="fTeX">
            <domain>Documentation</domain>
            <level>recommended</level>
        </format>
        <format id="fXML">
            <domain>Documentation</domain>
            <level>recommended</level>
        </format>
        <format id="fGML">
            <domain>Geodata</domain>
            <level>recommended</level>
        </format>
        <format id="fKML">
            <domain>Geodata</domain>
            <level>recommended</level>
        </format>
        <format id="fGIF">
            <domain>Image Source Language Data</domain>
            <level>recommended</level>
        </format>
        <format id="fJPEG">
            <domain>Image Source Language Data</domain>
            <level>recommended</level>
        </format>
        <format id="fPDFA">
            <domain>Image Source Language Data</domain>
            <level>recommended</level>
        </format>
        <format id="fPly">
            <domain>Image Source Language Data</domain>
            <level>recommended</level>
        </format>
        <format id="fPNG">
            <domain>Image Source Language Data</domain>
            <level>recommended</level>
        </format>
        <format id="fTIFF">
            <domain>Image Source Language Data</domain>
            <level>recommended</level>
        </format>
        <format id="fWFObj">
            <domain>Image Source Language Data</domain>
            <level>recommended</level>
        </format>
        <format id="fCSV">
            <domain>Lexical Resource</domain>
            <level>recommended</level>
        </format>
        <format id="fHDF5">
            <domain>Lexical Resource</domain>
            <level>recommended</level>
        </format>
        <format id="fBiBTeX">
            <domain>Metadata</domain>
            <level>recommended</level>
        </format>
        <format id="fPDF">
            <domain>Other</domain>
            <level>acceptable</level>
        </format>
        <format id="fR">
            <domain>Statistical Data</domain>
            <level>recommended</level>
        </format>
        <format id="fCoNLL-U">
            <domain>Text Annotation</domain>
            <level>recommended</level>
        </format>
        <format id="fDTABf">
            <domain>Text Annotation</domain>
            <level>recommended</level>
        </format>
        <format id="fI5">
            <domain>Text Annotation</domain>
            <level>recommended</level>
        </format>
        <format id="fJSONLD">
            <domain>Text Annotation</domain>
            <level>recommended</level>
        </format>
        <format id="fNTriples">
            <domain>Text Annotation</domain>
            <level>recommended</level>
        </format>
        <format id="fRDFXML">
            <domain>Text Annotation</domain>
            <level>recommended</level>
        </format>
        <format id="fTEI">
            <domain>Text Annotation</domain>
            <level>recommended</level>
        </format>
        <format id="fTurtle">
            <domain>Text Annotation</domain>
            <level>recommended</level>
        </format>
        <format id="fXML">
            <domain>Text Annotation</domain>
            <level>recommended</level>
        </format>
        <format id="fPDF">
            <domain>Textual Source Language Data</domain>
            <level>acceptable</level>
        </format>
        <format id="fPDFA">
            <domain>Textual Source Language Data</domain>
            <level>recommended</level>
        </format>
        <format id="fTCF">
            <domain>Textual Source Language Data</domain>
            <level>recommended</level>
        </format>
        <format id="fTextPlain">
            <domain>Textual Source Language Data</domain>
            <level>recommended</level>
        </format>
        <format id="fCSS">
            <domain>Tool Support</domain>
            <level>recommended</level>
        </format>
        <format id="fDTD">
            <domain>Tool Support</domain>
            <level>recommended</level>
        </format>
        <format id="fECMA">
            <domain>Tool Support</domain>
            <level>recommended</level>
        </format>
        <format id="fGZIP">
            <domain>Tool Support</domain>
            <level>recommended</level>
        </format>
        <format id="fJS">
            <domain>Tool Support</domain>
            <level>recommended</level>
        </format>
        <format id="fXSD">
            <domain>Tool Support</domain>
            <level>recommended</level>
        </format>
        <format id="fXSLT">
            <domain>Tool Support</domain>
            <level>recommended</level>
        </format>
        <format id="fZIP">
            <domain>Tool Support</domain>
            <level>recommended</level>
        </format>
    </formats>
</recommendation>
